{
  "version": "0.1-demo",
  "notice": "[ПРОВЕРИТЬ ПО ТЕКСТУ ГОСТ] Учебные схематичные пиктограммы и параметры; не являются официальной нормативной базой.",
  "parameters": {
    "defaultHeightMm": 10,
    "uniformToleranceMm": 0.01,
    "snapToleranceMm": 250,
    "maxAutoSnapDistanceMm": 3500,
    "pathLineWeightMm": 0.5,
    "pathColor": "#008855",
    "arrowSpacingMm": 3500,
    "arrowSizeMm": 500,
    "overlapThreshold": 0.15,
    "offsetStepMm": 250,
    "maxOffsetSteps": 80,
    "duplicateToleranceMm": 1,
    "floorFrameWidthMm": 600,
    "floorFrameHeightMm": 400,
    "localFrameWidthMm": 400,
    "localFrameHeightMm": 300
  },
  "fireInstructionTemplate": {
    "approval": "УТВЕРЖДАЮ",
    "title": "ПЛАН ЭВАКУАЦИИ при пожаре",
    "instructions": "При обнаружении пожара сообщите по телефонам 101 и 112, предупредите людей, покиньте здание по указанным путям и следуйте указаниям ответственных лиц. Не пользуйтесь лифтом."
  },
  "signs": [
    {
      "code": "E01-01",
      "name": "Выход здесь (левосторонний)",
      "officialDescription": "Выход здесь (левосторонний)",
      "category": "E",
      "shape": "Square",
      "aspectRatio": 1,
      "minHeightMm": 8,
      "maxHeightMm": 15,
      "defaultHeightMm": 10,
      "gostClauseRef": "[ПРОВЕРИТЬ ПО ТЕКСТУ ГОСТ] Код, назначение, изображение и размер не сверены с официальным текстом.",
      "backgroundColor": "#008855",
      "isExit": true,
      "primitives": [
        {
          "type": "Polyline",
          "points": [
            {
              "x": 0.83,
              "y": 0.15
            },
            {
              "x": 0.83,
              "y": 0.84
            },
            {
              "x": 0.22,
              "y": 0.84
            },
            {
              "x": 0.22,
              "y": 0.15
            }
          ],
          "stroke": "#FFFFFF",
          "strokeWidth": 0.045
        },
        {
          "type": "Polyline",
          "points": [
            {
              "x": 0.75,
              "y": 0.18
            },
            {
              "x": 0.75,
              "y": 0.78
            },
            {
              "x": 0.63,
              "y": 0.78
            }
          ],
          "stroke": "#FFFFFF",
          "strokeWidth": 0.035
        },
        {
          "type": "Circle",
          "x": 0.54,
          "y": 0.73,
          "radius": 0.065,
          "fill": "#FFFFFF"
        },
        {
          "type": "Polygon",
          "points": [
            {
              "x": 0.59,
              "y": 0.64
            },
            {
              "x": 0.48,
              "y": 0.6
            },
            {
              "x": 0.43,
              "y": 0.49
            },
            {
              "x": 0.52,
              "y": 0.44
            },
            {
              "x": 0.61,
              "y": 0.53
            }
          ],
          "fill": "#FFFFFF"
        },
        {
          "type": "Polyline",
          "points": [
            {
              "x": 0.57,
              "y": 0.56
            },
            {
              "x": 0.68,
              "y": 0.48
            },
            {
              "x": 0.77,
              "y": 0.51
            }
          ],
          "stroke": "#FFFFFF",
          "strokeWidth": 0.055
        },
        {
          "type": "Polyline",
          "points": [
            {
              "x": 0.48,
              "y": 0.58
            },
            {
              "x": 0.39,
              "y": 0.52
            },
            {
              "x": 0.32,
              "y": 0.56
            }
          ],
          "stroke": "#FFFFFF",
          "strokeWidth": 0.055
        },
        {
          "type": "Polyline",
          "points": [
            {
              "x": 0.53,
              "y": 0.45
            },
            {
              "x": 0.63,
              "y": 0.31
            },
            {
              "x": 0.72,
              "y": 0.25
            }
          ],
          "stroke": "#FFFFFF",
          "strokeWidth": 0.065
        },
        {
          "type": "Polyline",
          "points": [
            {
              "x": 0.5,
              "y": 0.45
            },
            {
              "x": 0.41,
              "y": 0.34
            },
            {
              "x": 0.3,
              "y": 0.3
            }
          ],
          "stroke": "#FFFFFF",
          "strokeWidth": 0.065
        }
      ]
    },
    {
      "code": "E01-02",
      "name": "Выход здесь (правосторонний)",
      "officialDescription": "Выход здесь (правосторонний)",
      "category": "E",
      "shape": "Square",
      "aspectRatio": 1,
      "minHeightMm": 8,
      "maxHeightMm": 15,
      "defaultHeightMm": 10,
      "gostClauseRef": "[ПРОВЕРИТЬ ПО ТЕКСТУ ГОСТ] Код, назначение, изображение и размер не сверены с официальным текстом.",
      "backgroundColor": "#008855",
      "isExit": true,
      "primitives": [
        {
          "type": "Polyline",
          "points": [
            {
              "x": 0.17,
              "y": 0.15
            },
            {
              "x": 0.17,
              "y": 0.84
            },
            {
              "x": 0.78,
              "y": 0.84
            },
            {
              "x": 0.78,
              "y": 0.15
            }
          ],
          "stroke": "#FFFFFF",
          "strokeWidth": 0.045
        },
        {
          "type": "Polyline",
          "points": [
            {
              "x": 0.25,
              "y": 0.18
            },
            {
              "x": 0.25,
              "y": 0.78
            },
            {
              "x": 0.37,
              "y": 0.78
            }
          ],
          "stroke": "#FFFFFF",
          "strokeWidth": 0.035
        },
        {
          "type": "Circle",
          "x": 0.46,
          "y": 0.73,
          "radius": 0.065,
          "fill": "#FFFFFF"
        },
        {
          "type": "Polygon",
          "points": [
            {
              "x": 0.41,
              "y": 0.64
            },
            {
              "x": 0.52,
              "y": 0.6
            },
            {
              "x": 0.57,
              "y": 0.49
            },
            {
              "x": 0.48,
              "y": 0.44
            },
            {
              "x": 0.39,
              "y": 0.53
            }
          ],
          "fill": "#FFFFFF"
        },
        {
          "type": "Polyline",
          "points": [
            {
              "x": 0.43,
              "y": 0.56
            },
            {
              "x": 0.32,
              "y": 0.48
            },
            {
              "x": 0.23,
              "y": 0.51
            }
          ],
          "stroke": "#FFFFFF",
          "strokeWidth": 0.055
        },
        {
          "type": "Polyline",
          "points": [
            {
              "x": 0.52,
              "y": 0.58
            },
            {
              "x": 0.61,
              "y": 0.52
            },
            {
              "x": 0.68,
              "y": 0.56
            }
          ],
          "stroke": "#FFFFFF",
          "strokeWidth": 0.055
        },
        {
          "type": "Polyline",
          "points": [
            {
              "x": 0.47,
              "y": 0.45
            },
            {
              "x": 0.37,
              "y": 0.31
            },
            {
              "x": 0.28,
              "y": 0.25
            }
          ],
          "stroke": "#FFFFFF",
          "strokeWidth": 0.065
        },
        {
          "type": "Polyline",
          "points": [
            {
              "x": 0.5,
              "y": 0.45
            },
            {
              "x": 0.59,
              "y": 0.34
            },
            {
              "x": 0.7,
              "y": 0.3
            }
          ],
          "stroke": "#FFFFFF",
          "strokeWidth": 0.065
        }
      ]
    },
    {
      "code": "E02-01",
      "name": "Направляющая стрелка вправо",
      "officialDescription": "Направляющая стрелка вправо",
      "category": "E",
      "shape": "Square",
      "aspectRatio": 1,
      "minHeightMm": 8,
      "maxHeightMm": 15,
      "defaultHeightMm": 10,
      "gostClauseRef": "[ПРОВЕРИТЬ ПО ТЕКСТУ ГОСТ] Код, назначение, изображение и размер не сверены с официальным текстом.",
      "backgroundColor": "#008855",
      "isExit": false,
      "primitives": [
        {
          "type": "Polygon",
          "points": [
            {
              "x": 0.175,
              "y": 0.43
            },
            {
              "x": 0.565,
              "y": 0.43
            },
            {
              "x": 0.565,
              "y": 0.36
            },
            {
              "x": 0.825,
              "y": 0.5
            },
            {
              "x": 0.565,
              "y": 0.64
            },
            {
              "x": 0.565,
              "y": 0.57
            },
            {
              "x": 0.175,
              "y": 0.57
            }
          ],
          "fill": "#FFFFFF"
        }
      ]
    },
    {
      "code": "E02-02",
      "name": "Направляющая стрелка под углом 45°",
      "officialDescription": "Направляющая стрелка под углом 45°",
      "category": "E",
      "shape": "Square",
      "aspectRatio": 1,
      "minHeightMm": 8,
      "maxHeightMm": 15,
      "defaultHeightMm": 10,
      "gostClauseRef": "[ПРОВЕРИТЬ ПО ТЕКСТУ ГОСТ] Код, назначение, изображение и размер не сверены с официальным текстом.",
      "backgroundColor": "#008855",
      "isExit": false,
      "primitives": [
        {
          "type": "Polygon",
          "points": [
            {
              "x": 0.3197,
              "y": 0.2207
            },
            {
              "x": 0.5955,
              "y": 0.4965
            },
            {
              "x": 0.645,
              "y": 0.447
            },
            {